{
  "repo": "py-sec-edgar-m",
  "release_role": "conservative validator/signoff consumer",
  "facade_module": "py_sec_edgar.wave4_shared._shared_backend",
  "required_validation": "strict-v1 facade behavior, non-pilot validate-only preservation, no-dual-authority preservation",
  "evidence_artifact": "RC validation note + signoff template bundle"
}