{
  "repo": "py-sec-edgar-m",
  "release_role": "conservative validator/signoff consumer for non-pilot and no-dual-authority safety",
  "facade_module": "py_sec_edgar.wave4_shared",
  "required_validation": "strict-v1 facade behavior, non-pilot validate-only preservation, no-dual-authority preservation, compatibility/canonical CLI surface stability",
  "evidence_artifact": "repo signoff evidence record with required handoff fields"
}
